{
  "oap_version": "0.1",
  "agent_id": "com.oap.finance",
  "name": "Finance Agent",
  "description": "Helps users track spending and set budgets.",
  "author": { "name": "OAP Example", "contact": "n/a" },
  "runtime_compatibility": {
    "models_supported": ["openai:gpt-5", "local:llama3"]
  },
  "permissions": ["files.read", "files.write", "notifications.send"],
  "memory": { "enabled": true, "scope": "per_user" },
  "version": "0.1.0"
}
